"Determine in which country iDEAL should be available. This setting doesn't apply to fast checkout.","Déterminez dans quel pays iDEAL doit être disponible. Ce paramètre ne s'applique pas à Fastcheckout."
"Set the minimum order amount for iDEAL to be available. Leave blank if you don't want to set a minimum amount. This setting doesn't apply to fast checkout.","Définissez le montant minimum de commande pour que iDEAL soit disponible. Laissez ce champ vide si vous ne souhaitez pas définir de montant minimum. Ce paramètre ne s'applique pas à Fastcheckout."
"Set the maximum order amount for iDEAL to be available. Leave blank if you don't want to set a maximum amount. This setting doesn't apply to fast checkout.","Définissez le montant maximum de commande pour que iDEAL soit disponible. Laissez ce champ vide si vous ne souhaitez pas définir de montant maximum. Ce paramètre ne s'applique pas à Fastcheckout."
"By default payment methods are available for all customer types. To limit this to a customer type, use one of the following options:

Private, B2C: Only show this payment method when the customer didn't enter a company name.

Business, BB2: Only show this payment method when the customer entered a company name.

This setting doesn't apply to fast checkout.","Par défaut, les modes de paiement sont disponibles pour tous les types de clients. Pour limiter cette option à un type de client, utilisez l'une des options suivantes:

Privé, B2C: affichez ce mode de paiement uniquement lorsque le client n'a pas saisi de nom d'entreprise.

Entreprise, BB2: affichez ce mode de paiement uniquement lorsque le client a saisi un nom d'entreprise.

Ce paramètre ne s'applique pas à Fastcheckout."
"Select to which customer group iDEAL is available. Customer groups are defined in Magento (Menu: Customers->Customer Groups).

This setting doesn't apply to fast checkout.","Sélectionnez le groupe de clients auquel iDEAL est disponible. Les groupes de clients sont définis dans Magento (Menu: Clients->Groupes de clients).

Ce paramètre ne s'applique pas à Fastcheckout."
"Fast Checkout","Fastcheckout"
"iDEAL Fast Checkout","iDEAL Fastcheckout"
"Cart page","Page du panier"
"Minicart","Mini-panier"
"Product page","Page produit"
"Default shipping method","Méthode d'expédition par défaut"
"Fallback shipping method","Méthode d'expédition de secours"
"Fallback","Retomber"
"Use estimate selection","Utiliser la sélection d'estimation"
"Guest checkout only","Paiement réservé aux invités uniquement"
"Show the fast checkout button on the cart page.

This button allows users to checkout directly from the cart without the need to fill in their address.","Afficher le bouton de paiement rapide sur la page du panier.

Ce bouton permet aux utilisateurs de payer directement depuis le panier sans avoir à renseigner leur adresse."
"Show the fast checkout button on the minicart.

This button allows users to checkout directly from the minicart without the need to fill in their address.","Afficher le bouton de paiement rapide sur le mini-panier.

Ce bouton permet aux utilisateurs de payer directement depuis le mini-panier sans avoir à renseigner leur adresse."
"Show the fast checkout button on every product page.

This button allows users to checkout directly from the cart without the need to fill in their address.","Affichez le bouton de paiement rapide sur chaque page produit.

Ce bouton permet aux utilisateurs de payer directement depuis le panier sans avoir à renseigner leur adresse."
"Select the shipping method that should be applied first.","Sélectionnez le mode d’expédition qui doit être appliqué en premier."
"The default shipping method will be applied to fast checkout orders.","La méthode d'expédition par défaut sera appliquée aux commandes de paiement rapide."
"Select the fallback shipping method, which will be applied when the default shipping method could not be applied.","Sélectionnez la méthode d'expédition de secours, qui sera appliquée lorsque la méthode d'expédition par défaut ne pourra pas être appliquée."
"In case the default shipping method could not by applied, this shipping method will be used.","Dans le cas où le mode d'expédition par défaut ne pourrait pas être appliqué, ce mode d'expédition sera utilisé."
"Select what should happen when both shipping methods could not be applied:

Show notice and abort fast checkout:
When this option is selected the fast checkout will be aborted in case the selected shipping method does not work for the order, the customer is redirected back to the cart page and shown a notice.

Show intermediate screen to select shipping method:
Using the intermediate screen will allow users to select their own shipping method in case the selected shipping method does not work for the order.","Sélectionnez ce qui doit se produire lorsque les deux méthodes d'expédition ne peuvent pas être appliquées :

Afficher un avis et abandonner le paiement rapide :
Lorsque cette option est sélectionnée, le paiement rapide sera abandonné si le mode d'expédition sélectionné ne fonctionne pas pour la commande, le client sera redirigé vers la page du panier et un avis s'affichera.

Afficher l'écran intermédiaire pour sélectionner le mode d'expédition :
L'utilisation de l'écran intermédiaire permettra aux utilisateurs de sélectionner leur propre mode d'expédition au cas où le mode d'expédition sélectionné ne fonctionnerait pas pour la commande."
"When the user selects a shipping method in the estimate on the cart page, this shipping method wil be used for fast checkout.","Lorsque l'utilisateur sélectionne un mode d'expédition dans l'estimation sur la page du panier, ce mode d'expédition sera utilisé pour un paiement rapide."
"When enabled, the fast checkout button will only be shown on the cart page for guest users.

This setting does not effect the product page. If fast checkout is enabled for the product page, the fast checkout button will always be shown.","Lorsque cette option est activée, le bouton de paiement rapide ne s'affiche sur la page du panier que pour les utilisateurs invités.

Ce paramètre n'affecte pas la page produit. Si le paiement rapide est activé pour la page produit, le bouton de paiement rapide sera toujours affiché."
"Show the fast checkout button on the cart page, only for guest customers.","Afficher le bouton de paiement rapide sur la page du panier, uniquement pour les clients invités."
"When updating this setting, please flush Magento's cache afterwards ","Lors de la mise à jour de ce paramètre, veuillez ensuite vider le cache de Magento "
"Continue","Continuer"
"On - as Optional","Activé - en option"
"On - as Required","Activé - en requis"
"Show notice and abort fast checkout","Afficher un avis et abandonner le fastcheckout"
"Show intermediate screen to select shipping method","Afficher l'écran intermédiaire pour sélectionner la méthode d'expédition"
"Thank you for your purchase, as soon as the payment is completed you will receive an email.","Nous vous remercions pour votre commande. Dès que le paiement aura été traité, vous recevrez un e-mail."
"Use browser language","Utiliser la langue du navigateur"
"Use website language","Utiliser la langue du site Web"
"American","Américain"
"Mexican","Mexicain"
"Hungarian","Hongrois"
"Norwegian","Norvégien"
"Croatian","Croate"
"Portuguese","Portugais"
"Romanian","Roumain"
"Swedish","Suédois"
"Slovenian","Slovène"
"Turkish","Turc"
"Finnish","Finlandais"
"Czech","Tchèque"
"Greek","Grec"
"Japanese","Japonais"
"Show modal","Afficher la fenêtre modale"
"When enabled, a modal explaining on how fast checkout works will show before going through with fast checkout.","Lorsque cette option est activée, une fenêtre modale expliquant le fonctionnement de la caisse rapide s'affiche avant le passage à la caisse rapide."
"Open modal before fast checkout","Ouvrir une fenêtre modale avant le paiement rapide"
"Order faster","Commander plus rapidement"
"with iDEAL fast checkout","avec iDEAL fast checkout"
"Create an iDEAL profile and save your address for your next order","Créez un profil iDEAL et enregistrez votre adresse pour votre prochaine commande."
"Enter my own address and pay","Entrer mon adresse et payer"
"Use expected order-ID","Utiliser l'ID de commande attendu"
"Magento determines the order ID that will be assigned to an upcoming order in advance. You can utilize this ID for the "order description" field in Pay.

Please note that if an order is canceled, it may create a gap in your Magento order sequence.","Magento détermine à l'avance l'ID de commande qui sera attribué à une commande à venir. Vous pouvez utiliser cet ID pour le champ « Description de la commande » dans Pay.

Veuillez noter que si une commande est annulée, cela peut créer un écart dans votre séquence de commandes Magento."
"Use the expected next order ID for order description.","Utilisez l’ID de commande suivant attendu pour la description de la commande."
"Renew quote-id (default)","Renouveler quote-id (default)"
"Maintain quote-id","Maintenir quote-id"
"Renew quote-id
A new quote ID will be created for the cart after a canceled payment.

Maintain quote-id
The existing quote ID will be reused to start a new order.","Renouveler l'identifiant de devis
Un nouvel identifiant de devis sera créé pour le panier après un paiement annulé.

Maintenir l'identifiant de devis
L'identifiant de devis existant sera réutilisé pour démarrer une nouvelle commande."
"Cancel behaviour", "Annuler le comportement"