"New order email sent","Nouveau courriel de commande envoyé"
"You notified customer about invoice #%1.","Vous avez informé le client concernant la facture #%1."
"PAY. canceled the order","PAY. a annulé la commande"
"PAY. Uncanceled order","PAY. - Annulation de commande annulée"
"We cannot un-cancel this order.","Nous ne pouvons pas annuler cette annulation de commande."
"Invalid return, no transactionId specified","Retour invalide, aucun transactionId spécifié"
"There was an error checking the transaction status","Une erreur s'est produite lors de la vérification du statut de la transaction"
"Order has been made and the payment is pending.","La commande a été effectuée et le paiement est en attente."
"Payment canceled","Paiement annulé"
"Payment denied","Paiement refusé"
"Something went wrong, please try again later","Quelque chose s'est mal passé, veuillez réessayer plus tard"
"Enter your API token and SL-code first","Entrez d'abord votre jeton API et votre ID de service"
"No","Non"
"Yes","Oui"
"Not active, activate on My.pay.nl first","Non disponible, vous pouvez l'activer sur admin.pay.nl"
"Dutch","Néerlandais"
"English","Anglais"
"German","Allemand"
"Italian","Italien"
"French","Français"
"Spanish","Espagnol"
"After successful payment","Après un paiement réussi"
"Before payment","Avant le paiement"
"Choose your bank","Choisissez votre banque"
"Choose the pin terminal","Choisissez le terminal PIN"
"Notice","Remarque"
"An e-mail containing a PAY. paylink will be send.","Un courriel contenant un lien de paiement PAY. sera envoyé."
"Valid for","Valable pour"
"days","jours"
"Enabled","Activé"
"Title","Titre"
"New Order Status","Nouveau statut de commande"
"Payment from Applicable Countries","Pays de paiement applicables"
"Payment from Specific Countries","Paiement à partir de pays spécifiques"
"Instructions","Instructions"
"Minimum Order Total","Total minimum de la commande"
"Maximum Order Total","Total maximum de la commande"
"Sort Order","Ordre de tri"
"Send new order email","Envoyer un nouvel e-mail de commande"
"Advanced","Avancé"
"Payment option id","ID de l'option de paiement"
"Show bankselection","Afficher la sélection de la banque"
"PAY. Settings","Paramètres PAY."
"The id of the payment method, only change this if you are told to do so","L'identifiant de la méthode de paiement, ne le changez que si on vous le demande"
"Testmode","Mode de test"
"API token","Jeton API"
"Token code","Token code"
"Set order on-hold","Mettre la commande en attente"
"Sales location","Services"
"Language payment screen","Langue de l'écran de paiement"
"Never cancel order","Ne jamais annuler la commande"
"Paymentmethods","Méthodes de paiement"
"When enabled, Magento will not cancel the order when the transaction is cancelled via Pay.","Lorsque cette option est activée, Magento n'annule pas la commande lorsque la transaction est annulée via Pay."
"Always use base currency","Toujours utiliser la devise de base"
"Set this to yes if you always want to process payments in the base currency of this store.","Définissez cette option sur oui si vous souhaitez toujours traiter les paiements dans la devise de base de ce magasin."
"Skip fraud detection","Ignorer la détection de fraude"
"Sometimes magento incorrectly marks an order as fraudulent. this happens more often when using different currencies. Set this to yes to skip fraud detection.","Parfois, Magento marque incorrectement une commande comme frauduleuse. Cela se produit plus souvent lorsque vous utilisez différentes devises. Définissez cette option sur oui pour ignorer la détection de fraude."
"Get your AT-code <a target='_blank' href='https://admin.pay.nl/company/tokens'>here</a>. Not registered at PAY? Sign up <a target='_blank' href='https://www.pay.nl/en?register'>here</a>!", "Obtenez votre code AT <a target='_blank' href='https://admin.pay.nl/company/tokens'>ici</a>. Pas encore enregistré chez PAY ? Inscrivez-vous <a target='_blank' href='https://www.pay.nl/en?register'>ici</a> !"
"Your API token, you can find your tokens <a target='_blank' href='https://my.pay.nl/company/tokens'>here</a>.", "Votre jeton API, vous pouvez trouver vos jetons <a target='_blank' href='https://admin.pay.nl/company/tokens'>ici</a>"
"The SL-code of your sales location, you can find your sales locations  <a target='_blank' href='https://my.pay.nl/programs/programs'>here</a>.", "Le code SL de votre service, vous pouvez trouver vos services <a target='_blank' href='https://admin.pay.nl/programs/programs'>ici</a>"
"URL of the payment option icons. Default URL: https://static.pay.nl/payment_profiles/50x32/#paymentOptionId#.png","URL des icônes des options de paiement. URL par défaut : https://static.pay.nl/payment_profiles/50x32/#paymentOptionId#.png"
"Send discount tax","Envoyer la taxe de réduction"
"Set this to NO if you have a mix of low and high vatrate products. Some pay later methods have issues when the discount has a tax amount other than the default vat categories","Réglez cette option sur NON si vous avez un mélange de produits à taux de TVA bas et élevé. Certaines méthodes de paiement différé posent problème lorsque la réduction a un montant de taxe autre que les catégories de TVA par défaut."
"Paylink is only available for backorders and won't appear in the checkout","Le lien de paiement n'est disponible que pour les commandes en attente et n'apparaîtra pas à la caisse"
"Thank you for your order from ","Merci pour votre commande de "
"If you have questions about your order, you can email us at","Si vous avez des questions concernant votre commande, vous pouvez nous envoyer un e-mail à"
"To finish your order, click the link below","Cliquez sur le lien ci-dessous pour payer votre commande"
"PAY. paylink","PAY. lien de paiement"
"Paylink order","Lien de paiement de la commande"
"A Pay. paylink has been sent to","Un e-mail contenant un PAY. lien de paiement sera envoyé à"
"Billing Info","Adresse de facturation"
"Shipping Info","Adresse de livraison"
"Payment Method","Méthode de paiement"
"Shipping Method","Méthode d'expédition"
"Your Order","Votre commande"
"Placed on","Passée le"
"Qty","Quantité"
"Items","Articles"
"Price","Prix"
"Subtotal","Sous-total"
"Shipping & Handling","Livraison et manutention"
"Grand Total","Total"
"Offline refund","Remboursement hors ligne"
"This will create an offline refund. To create an online refund, open an invoice and create credit memo for it. Do you want to continue?","Ceci créera un remboursement hors ligne. Pour créer un remboursement en ligne, ouvrez une facture et créez une note de crédit. Voulez-vous continuer?"
"Thank you for your purchase!","Merci pour votre achat!"
"The payment has been canceled.","Le paiement a été annulé."
"PAY. -Order has been shipped, but no invoice was found. Capturing the payment automatically.","PAY. -La commande a été expédiée mais aucune facture n'a été trouvée. Le paiement sera automatiquement capturé."
"On","Activé"
"On - via Wuunder","Activé - via Wuunder"
"On - via Sherpa","Activé - via Sherpa"
"Off","Désactivé"
"Auto capture","Capture automatique"
"Automatically capture authorisation-transaction when creating the shipment for the order.","Capture automatiquement une transaction d'autorisation lors de la création de l'expédition pour la commande."
"PAY. - Performed auto-capture. Result: ","PAY. - Capture automatique effectuée. Résultat: "
"All of them","Tous"
"Custom","Personnalisé"
"Only available with IP-Address","Uniquement disponible avec l'adresse IP"
"Add a comma between IP addresses for multiple inputs.","Ajoutez une virgule entre les adresses IP pour plusieurs entrées."
"Only available with useragent","Uniquement disponible avec l'agent utilisateur"
"Custom useragent","Agent utilisateur personnalisé"
"Add a comma between useragents for multiple inputs.","Ajoutez une virgule entre les agents utilisateurs pour plusieurs entrées."
"Show COC field","Afficher le champ Chambre de Commerce"
"When chosen for this method the customer can additionally enter his COC before continuing.","Si cette méthode est choisie, le client peut également saisir son Chambre de Commerce avant de continuer."
"Show VAT field","Afficher le champ de numéro de TVA"
"When chosen for this method the customer can additionally enter his VAT-id before continuing.","Si cette méthode est choisie, le client peut également saisir son numéro de TVA avant de continuer."
"Show Date of birth field","Afficher le champ de la date de naissance"
"When chosen for this method the customer can additionally enter his date of birth before continuing.","Si cette méthode est choisie, le client peut également saisir sa date de naissance avant de continuer."
"Optional","Comme optionnel"
"Required","Comme requis"
"Optional for business customers","Optionnel pour les clients professionnels"
"Required for business customers","Requis pour les clients professionnels"
"COC number","Numéro de Chambre de Commerce"
"VAT number","Numéro de TVA"
"Date of birth","Date de naissance"
"Invalid VAT number","Numéro de TVA invalide"
"Enter a valid VAT number","Veuillez entrer un numéro de TVA valide."
"Invalid date of birth","Date de naissance invalide"
"Enter a valid date of birth","Veuillez entrer une date de naissance valide."
"Invalid COC number","Numéro de Chambre de Commerce invalide"
"Enter a valid COC number","Veuillez entrer un numéro de Chambre de Commerce valide."
"Payment terms","Conditions de paiement"
"You must first agree to the payment terms.","Vous devez d'abord accepter les conditions de paiement."
"If you have a feature request or other ideas, let us know!","Si vous avez une demande de fonctionnalité ou d'autres idées, faites-le nous savoir !"
"Your submission will be reviewed by our development team.","Votre demande sera examinée par notre équipe de développement."
"If needed, we will contact you for further information via the e-mail address provided.","Si nécessaire, nous vous contacterons pour de plus amples informations via l'adresse électronique fournie."
"Please note: this form is not for Support requests, please contact support@pay.nl for this.","Remarque: ce formulaire n'est pas destiné aux demandes d'assistance. Pour les questions d'assistance, veuillez contacter support@pay.nl."
"Email","E-mail"
"Message","Message"
"Leave your suggestions here...","Laissez nous vos remarques et/ou suggestions…..."
"Sent! Thank you for your contribution.",Envoyé ! Merci pour votre contribution."
"Email could not be sent, please try again later.","E-mail sans mot de passe. Il sera examiné plus tard."
"Suggestions?","Suggestions?"
"Pay. - Suggestions?","Pay. - Suggestions?"
"Submit", "Soumettre"
"Please fill in your message.","Veuillez remplir votre message."
"Please fill in a valid email.","Veuillez remplir un email valide."
"Success", "Succès"
"Error", "Erreur"
"PAY. - Refund initiated from Pay.","Pay. - Remboursement initié par Pay."
"Set to `on` to accept refunds initiated from Pay.","Régler sur `Activé` pour accepter les remboursements initiés par Pay."
"Token code, API token and SL-code are required","Le code du jeton, le jeton API et le code SL-code"
"SL-code, API token or token code invalid","SL-code, jeton API ou code de jeton invalide"
"SL-code is invalid","SL-code n'est pas valide"
"SL-code / API token combination invalid","Combinaison SL-code/jeton API invalide"
"Dropdown","Dérouler"
"List with logos","Liste avec logos"
"Pay: here is your","Pay.: voici votre"
"Prefix the order description with a custom word","Préfixez la description de la commande avec un mot personnalisé"
"Select whether you want to use the Pay. thank you page when transaction is pending.","Sélectionnez si vous souhaitez utiliser la page de remerciement de Pay. lorsque la transaction est en attente."
"You are up to date with the latest version","Vous êtes à jour avec la dernière version"
"Enter your COC number","Entrez votre numéro de Chambre de Commerce"
"Enter your VAT number","Entrez votre numéro de TVA"
"We are experiencing technical issues. Please check ","Nous rencontrons des problèmes techniques. Veuillez consulter "
" for the latest updates."," pour les dernières mises à jour."
"You can set your failover gateway under ","Vous pouvez définir votre passerelle de basculement sous "
"settings","Paramètres"
".","."
"Show company field","Afficher le champ de l'entreprise"
"When enabled, in case company isn't already entered, an extra field is added to the payment method for customers to enter their company name.","Lorsqu'elle est activée, au cas où l'entreprise n'est pas déjà saisie, un champ supplémentaire est ajouté au mode de paiement pour que les clients puissent saisir le nom de leur entreprise."
"Company","Entreprise"
"Enter your company name","Entrez le nom de votre entreprise"
"Invalid company","Entreprise invalide"
"Entrez un nom d'entreprise valide","Voer een geldige bedrijfsnaam in"
"Payment location","Moment de code PIN"
"Pay by card","Épingler maintenant"
"Pay later, at pickup","Épinglez en magasin lors du retrait"
"Setting for where the payment should take place: instant, or at pickup location. Or provide this choice in the checkout.","Permettez aux clients de choisir de payer lors du retrait de la commande en magasin. Un bouton épingle sera visible dans la vue commande."
"PAY.: Payment at pick-up","Pay.: La commande a été créée pour le paiement au moment du retrait au magasin"
"Directly payment initialization(default)","Proposez uniquement l'option de paiement direct (par défaut)"
"Let payment take place at the pickup location, only create a backorder","Utiliser le paiement uniquement lorsque le retrait en magasin est sélectionné"
"Show a selection for the checkout-user to choose between direct payment or payment at location","Offrir le choix au client"
"Follow payment method","Follow payment method"
"This will ensure the order is updated with the actual payment method used to complete the order. This can differ from the payment method initially selected","Cela garantira que la commande est mise à jour avec le mode de paiement réel utilisé pour finaliser la commande. Celui-ci peut différer du mode de paiement initialement sélectionné"
"PAY.: Updated payment method from %1 to %2","PAY.: Mode de paiement modifié de %1 à %2"
"Don't show at payment method.":"Ne pas afficher le mode de paiement."
"Show DOB field at method, but leave it optional.":"Afficher le champ de la date de naissance dans la méthode, mais le laisser facultatif."
"Show DOB field at method, make it required.":"Afficher le champ de la date de naissance dans la méthode, le rendre obligatoire."
"Don't show DOB field at method, but set as required. Use DOB field from checkout instead.":"Ne pas afficher le champ de la date de naissance dans la méthode, mais le rendre obligatoire. Utilisez plutôt le champ de la date de naissance à la caisse."
"Show COC field at method, but leave it optional.":"Afficher le champ Chambre de Commerce dans la méthode, mais le laisser facultatif."
"Show COC field at method, make it required.":"Afficher le champ Chambre de Commerce dans la méthode, le rendre obligatoire."
"Don't show COC field at method, but set as required. Use COC field from checkout instead.":"Ne pas afficher le champ Chambre de Commerce dans la méthode, mais le rendre obligatoire. Utiliser le champ Chambre de Commerce de la caisse à la place."
"Show VAT field at method, but leave it optional.":"Afficher le champ de numéro de TVA dans la méthode, mais le laisser facultatif."
"Show VAT field at method, make it required.":"Afficher le champ de numéro de TVA dans la méthode, le rendre obligatoire."
"Don't show VAT field at method, but set as required. Use VAT field from checkout instead.":"Ne pas afficher le champ de numéro de TVA dans la méthode, mais le rendre obligatoire. Utiliser le champ de numéro de TVA de la caisse à la place."
"When Enabled, this will add an extra field to the payment method for the customer to enter in their COC number. You can also choose to make the COC number required for this method by using the 4th option. This will require you to enable the 'Show custom COC field' setting in the 'Settings' tab, which adds the COC field to the checkout itself.","Lorsque cette option est activée, un champ supplémentaire est ajouté à la méthode de paiement pour permettre au client d'entrer son numéro de Chambre de Commerce. Vous pouvez également choisir de rendre le numéro de Chambre de Commerce obligatoire pour cette méthode en utilisant la quatrième option. Pour ce faire, vous devez activer le paramètre "Afficher le champ Chambre de Commerce personnalisé" dans l'onglet "Paramètres", ce qui ajoute le champ Chambre de Commerce à la checkout."
"When Enabled, this will add an extra field to the payment method for the customer to enter in their VAT number. You can also choose to make the VAT number required for this method by using the 4th option. This will require you to enable the 'Show custom VAT field' setting in the 'Settings' tab, which adds the VAT field to the checkout itself.","Lorsque cette option est activée, un champ supplémentaire est ajouté à la méthode de paiement pour permettre au client d'entrer son numéro de TVA. Vous pouvez également choisir de rendre le numéro de TVA obligatoire pour cette méthode en utilisant la quatrième option. Pour ce faire, vous devez activer le paramètre "Afficher le champ de numéro de TVA personnalisé" dans l'onglet "Paramètres", ce qui ajoute le champ de numéro de TVA à la checkout."
"When Enabled, this will add an datepicker field to the payment method for the customer to enter in their date of birth. You can also choose to make this required for this method by using the 4th option. This will require you to enable the 'Show custom DOB field' setting in the 'Settings' tab, which adds the date of birth field to the checkout itself.","Lorsque cette option est activée, elle ajoute un champ de sélection de date à la méthode de paiement pour que le client puisse saisir sa date de naissance. Vous pouvez également choisir de rendre ce champ obligatoire pour ce mode de paiement en utilisant la quatrième option. Pour ce faire, vous devez activer le paramètre "Afficher le champ DOB personnalisé" dans l'onglet "Paramètres", ce qui ajoute le champ de la date de naissance à la caisse elle-même."
"Although an order is started with a certain payment method, it may still be completed with a different payment method. For example: Someone starts an order with IN3, but never completes it. When that person later receives a reminder email stating that the order is still open, he or she can complete it with iDEAL. When this option is enabled, iDEAL will be shown with the order. A note will also be placed in the order notes indicating that the payment method has changed.","Même si une commande est démarrée avec un certain mode de paiement, elle peut toujours être complétée avec un autre mode de paiement. Par exemple : quelqu'un commence une commande avec IN3, mais ne la termine jamais. Lorsque cette personne reçoit ultérieurement un e-mail de rappel indiquant que la commande est toujours ouverte, elle peut la compléter avec iDEAL. Lorsque cette option est activée, iDEAL sera affiché avec la commande. Une note sera également placée dans les bons de commande indiquant que le mode de paiement a changé."
"Although an order is started with a certain payment method, it may still be completed with a different payment method. For example: Someone starts an order with iDEAL in3, but never completes it. When that person later receives a reminder email stating that the order is still open, he or she can complete it with iDEAL. When this option is enabled, iDEAL will be shown with the order. A note will also be placed in the order notes indicating that the payment method has changed.","Même si une commande est démarrée avec un certain mode de paiement, elle peut toujours être complétée avec un autre mode de paiement. Par exemple : quelqu'un commence une commande avec iDEAL in3, mais ne la termine jamais. Lorsque cette personne reçoit ultérieurement un e-mail de rappel indiquant que la commande est toujours ouverte, elle peut la compléter avec iDEAL. Lorsque cette option est activée, iDEAL sera affiché avec la commande. Une note sera également placée dans les bons de commande indiquant que le mode de paiement a changé."
"Select the language in which payment screens open (such as the Credit Card screen or Transfer page). Please note: the language can also be changed from the payment screens.","Sélectionnez la langue dans laquelle les écrans de paiement s'ouvrent (comme l'écran Carte de crédit ou la page Transfert). Attention : la langue peut également être modifiée depuis les écrans de paiement."
"Off - No autocapture.
On - Automatically capture payments with the status AUTHORIZE when a shipment is created in Magento (Picqer is also supported in this).
On - via Wuunder - Capture automatically via Wuunder.
On - via Sherpa - Capture automatically via Sherpa.","Désactivé - Pas de capture automatique.
Activé - Capturer automatiquement les paiements avec le statut AUTORISER lorsqu'un envoi est créé dans Magento (Picqer est également pris en charge dans ce domaine).
Activé - via Wuunder - Capture automatique via Wuunder.
Activé - via Sherpa - Capture automatique via Sherpa."
"When the store currency deviates from the base currency setting in Magento, this setting will ensure the payment starts in the base currency instead of the store currency. Example: Store currency is in Dollar, Base currency is Euro. Pay. will start payments in Euro.","Lorsque la devise du magasin diffère de la devise de base dans Magento, ce paramètre garantit que le paiement commence dans la devise de base au lieu de la devise du magasin. Exemple : La devise du magasin est le dollar, la devise de base est l'euro. Pay. commencera les paiements en euros."
"When Enabled, this will add an extra field to the checkout for the customer to enter in their COC number.","Lorsque cette option est activée, un champ supplémentaire est ajouté à la caisse pour permettre au client d'entrer son numéro de Chambre de Commerce."
"When Enabled, this will add an extra field to the checkout for the customer to enter in their VAT number.","Lorsque cette option est activée, un champ supplémentaire est ajouté à la caisse pour permettre au client d'entrer son numéro de TVA."
"When Enabled, this will add an datepicker field to the checkout for the customer to enter in their date of birth.","Lorsque cette option est activée, elle ajoute un champ de sélection de date à la caisse pour permettre au client d'entrer sa date de naissance."
"Show custom COC field","Afficher le champ de numéro de Chambre de Commerce. personnalisé"
"Show custom VAT field","Afficher le champ de numéro de TVA personnalisé"
"Show custom date of birth field","Afficher le champ personnalisé de la date de naissance"
"When the store currency deviates from the base currency setting in Magento, this setting will ensure the payment starts in the base currency instead of the store currency.","Lorsque la devise du magasin diffère de la devise de base dans Magento, ce paramètre garantit que le paiement commence dans la devise de base au lieu de la devise du magasin."'
"Customer Type","Type de client"
"By default payment methods are available in the checkout for all customer types.
Private, B2C: Only show this payment method when the customer didn't enter a company name.
Business, BB2: Only show this payment method when the customer entered a company name.","Par défaut, les méthodes de paiement sont disponibles dans la caisse pour tous les types de clients.
Privé, B2C : N'affiche ce mode de paiement que si le client n'a pas saisi de nom d'entreprise.
Business, BB2 : n'affiche ce mode de paiement que lorsque le client a saisi un nom d'entreprise."
"Specify which type of customer this payment method should be available to.","Spécifiez à quel type de client ce mode de paiement doit être disponible."
"Chargebacks","Refacturation"
"Set to `on` to accept chargebacks initiated from Pay.","Réglez ce paramètre sur "on" pour accepter les rétrofacturations initiées par Pay."
"When this settings is enabled, chargebacks initiated by customers will refund the order in Magento.","Lorsque ce paramètre est activé, les rétrocessions initiées par les clients rembourseront la commande dans Magento."
"Pickup location needs to be turned on to make this setting work.
Direct checkout payment: pin transaction will be started right when the instore is selected in the checkout.
Payment takes place at the pickup location: the order is created in the Magento admin, the pin transaction can be started from there when the customer comes to pick up the order.
Provide this choice in the checkout: the customer can choose in the checkout between the options given above.","Le lieu de prise en charge doit être activé pour que ce paramètre fonctionne.
Paiement direct à la caisse : la transaction par code PIN sera lancée dès que le mode de paiement est sélectionné lors du paiement.
Le paiement s'effectue au lieu de retrait : la commande est créée dans l'admin Magento, la transaction PIN peut être lancée à partir de là lorsque le client vient récupérer la commande.
Proposer ce choix lors du paiement : le client peut choisir lors du paiement entre les options indiquées ci-dessus."
"Pay. Refund by card","Pay. Goupille de retour"
"Amount","Montant"
"Terminal","Terminal"
"Refund amount must be greater than 0.00","Le montant doit être supérieur à 0,00"
"Refund amount must not exceed ","Le montant ne peut excéder "
"Select a terminal","Sélectionnez un terminal"
